[
  {
    "name": "cdx_etf_basis",
    "description": "Flow-driven mispricing signal from CDX-ETF basis divergence",
    "compute_function_name": "compute_cdx_etf_basis",
    "data_requirements": {
      "cdx": "spread",
      "etf": "spread"
    },
    "arg_mapping": ["cdx", "etf"],
    "default_securities": {
      "cdx": "cdx_ig_5y",
      "etf": "lqd"
    },
    "enabled": true,
    "sign_multiplier": 1
  },
  {
    "name": "cdx_vix_gap",
    "description": "Cross-asset risk sentiment divergence between credit and equity volatility",
    "compute_function_name": "compute_cdx_vix_gap",
    "data_requirements": {
      "cdx": "spread",
      "vix": "level"
    },
    "arg_mapping": ["cdx", "vix"],
    "default_securities": {
      "cdx": "cdx_ig_5y",
      "vix": "vix"
    },
    "enabled": true,
    "sign_multiplier": 1
  },
  {
    "name": "spread_momentum",
    "description": "Short-term volatility-adjusted momentum in CDX spreads",
    "compute_function_name": "compute_spread_momentum",
    "data_requirements": {
      "cdx": "spread"
    },
    "arg_mapping": ["cdx"],
    "default_securities": {
      "cdx": "cdx_ig_5y"
    },
    "enabled": true,
    "sign_multiplier": 1
  }
]
